<?xml version="1.0" encoding="UTF-8"?>
<!DOCTYPE products [
    <!ENTITY currency "AUD">
    <!ENTITY company "DIY Paradise">

    <!ELEMENT products (category, product+)>
    <!ELEMENT category (#PCDATA)>
    <!ELEMENT product (name, description, pricing, searchTags?, reviews*, images+, relatedURL, specifications, manufacturer, stockLevel)>
    <!ELEMENT name (#PCDATA)>
    <!ELEMENT description (#PCDATA)>
    <!ELEMENT pricing (#PCDATA)>
    <!ELEMENT searchTags (tag*)>
    <!ELEMENT tag (#PCDATA)>
    <!ELEMENT reviews (review*)>
    <!ELEMENT review (#PCDATA)>
    <!ATTLIST review
        stars CDATA #REQUIRED
        date CDATA #REQUIRED>
    <!ELEMENT images (image+)>
    <!ELEMENT image EMPTY>
    <!ATTLIST image
        src CDATA #REQUIRED
        alt CDATA #REQUIRED>
    <!ELEMENT relatedURL (#PCDATA)>
    <!ELEMENT specifications (spec+)>
    <!ELEMENT spec (#PCDATA)>
    <!ATTLIST spec type CDATA #REQUIRED>
    <!ELEMENT manufacturer (#PCDATA)>
    <!ELEMENT stockLevel (#PCDATA)>
    <!ATTLIST stockLevel status (in-stock|low-stock|out-of-stock) #REQUIRED>
]>
<products>
    <category>Sample Category</category>
    <product>
        <name>Sample Product</name>
        <description>Sample description</description>
        <pricing>&currency; 0.00</pricing>
        <searchTags>
            <tag>sample</tag>
        </searchTags>
        <reviews>
            <review stars="5" date="2024-10-11">Sample review</review>
        </reviews>
        <images>
            <image src="images/sample.jpg" alt="Sample" />
        </images>
        <relatedURL>https://example.com</relatedURL>
        <specifications>
            <spec type="weight">0kg</spec>
        </specifications>
        <manufacturer>Sample Brand</manufacturer>
        <stockLevel status="in-stock">100</stockLevel>
    </product>
</products>